{
  "eventId": "evt_001",
  "principalId": "prn_biz_acme-co-001",
  "principalType": "organization",
  "scope": { "type": "account", "id": "acc_acme_001" },
  "agencyExpressionId": "ax_001",
  "eventType": "core.profile.extracted",
  "source": "onboarding-service",
  "actor": { "type": "system", "id": "onboarding-runtime" },
  "subject": { "type": "principal_profile", "id": "pp_001" },
  "payload": { "industry": "specialty-coffee", "displayName": "Acme Co." },
  "evidenceLevel": "inferred",
  "importance": "medium",
  "schemaVersion": "v0.0.1",
  "occurredAt": "2026-05-09T12:00:00Z",
  "audit": {
    "createdAt": "2026-05-09T12:00:00Z",
    "createdBy": { "actorType": "system", "actorId": "onboarding-runtime" }
  }
}
